moduleId,title,description,learningMaterialId,moduleKey
6706701a98ac07710c36b1c5,Thema vitium alo deludo.,Tabesco cariosus atque vesper thorax tepidus defleo approbo denego confero. Quod advenio amoveo reiciendis auditor copiose. Assumenda pectus subito vito deduco.,6706701a98ac07710c36afe6,203
6706701a98ac07710c36b1c6,Denique commodi contigo voro blanditiis.,Abbas adduco abeo teres ars veritas. Caveo quaerat pecto stipes. Cauda stips caveo cimentarius.,6706701a98ac07710c36b090,204
6706701a98ac07710c36b1c7,Qui peccatus cubicularis suadeo cogito veritas amplexus.,Voluptas stultus tenax abeo talio. Bos ambitus tepidus curtus corporis cena. Volva labore concedo cras porro unde video adamo tergiversatio.,6706701a98ac07710c36b0a1,205
6706701a98ac07710c36b1c8,Cimentarius una spero sint uterque.,Consectetur amiculum sumptus arguo ait necessitatibus ratione veritatis adnuo abduco. Cilicium deripio vulgivagus ago solum. Strenuus enim vesica.,6706701a98ac07710c36aff2,206
6706701a98ac07710c36b1c9,Strues totus teneo ratione.,Vos voluntarius deduco quibusdam eveniet deputo audax curto spiritus. Solium verus coniuratio constans defleo urbs textor caute harum. Cernuus vacuus mollitia deprimo arx vere voro dolor earum pectus.,6706701a98ac07710c36b0f4,207
6706701a98ac07710c36b1ca,Cicuta voluptates dens.,Cedo omnis aliqua comburo comes coerceo benigne arma voco. Circumvenio clarus temptatio porro ascit vis. Depereo titulus deleo cogito velum curatio uter trado peccatus.,6706701a98ac07710c36b0d9,208
6706701a98ac07710c36b1cb,Aureus vilicus truculenter validus constans conspergo corrupti credo.,Curo stipes qui vitiosus crastinus tepesco. Cras cado barba soluta. Territo coaegresco ars.,6706701a98ac07710c36aff2,209
6706701a98ac07710c36b1cc,Crastinus tondeo voluptatum caput ago soluta utor deludo advenio correptius.,Vomito cervus custodia coniecto admitto careo. Defetiscor sperno curto cavus demo tactus synagoga cupio accusamus. Caelestis adimpleo error ambitus sumo sunt.,6706701a98ac07710c36b093,210
6706701a98ac07710c36b1cd,Unde temeritas aeger usus excepturi.,Patrocinor tamquam vicissitudo. Caste consequuntur tui certe curtus aut aliqua. Minus eius est pecus harum.,6706701a98ac07710c36b007,211
6706701a98ac07710c36b1ce,Minima nesciunt civis sto credo.,Crapula capillus amissio decor. Admoveo textor tenuis capio depraedor distinctio uter desolo arx cariosus. Delego autem sophismata ipsa antea.,6706701a98ac07710c36b023,212
6706701a98ac07710c36b1cf,Crudelis numquam absconditus delego una tutis vicinus.,Terror solus surgo amplus tripudio cur certe confero argentum vallum. Venustas voveo acsi creber. Occaecati censura ancilla succurro utroque magni tego tenus.,6706701a98ac07710c36b000,213
6706701a98ac07710c36b1d0,Demum cometes crastinus thalassinus vehemens maiores.,Ultra despecto cupiditate contabesco cubitum arbor. Subvenio demo claustrum. Absque aetas alo tristis solus sopor.,6706701a98ac07710c36b0d3,214
6706701a98ac07710c36b1d1,Vulgivagus claudeo vapulus praesentium subvenio capillus ex patria abbas speculum.,Abundans sit aperiam infit dignissimos demitto ut cur. Arguo corpus talis arca subvenio. Validus torrens arguo.,6706701a98ac07710c36b061,215
6706701a98ac07710c36b1d2,Careo adnuo defero unde bis cuppedia aestivus est theatrum taedium.,Optio verbera cupiditate collum cupiditate absque commodi talis. Chirographum vinitor mollitia agnitio curo argumentum chirographum collum corrumpo. Benigne terebro rem tumultus.,6706701a98ac07710c36b0b5,216
6706701a98ac07710c36b1d3,Vos tonsor abeo argumentum nostrum quaerat curriculum eligendi cur vox.,Ex cohaero adulescens tumultus conor decumbo. Tandem bis comis varietas cibo advenio acervus uberrime. Omnis torrens suus solutio communis.,6706701a98ac07710c36b0d1,217
6706701a98ac07710c36b1d4,Adulatio summisse vado adduco curo crapula thymum arbustum tertius depono.,Asporto coma spiculum aegrus strues conservo aegrotatio caput eaque auditor. Sono vulgivagus apparatus summa totus thesis uredo tabella asporto. Conservo infit deputo carus quis adipiscor accusator fugit centum.,6706701a98ac07710c36b044,218
6706701a98ac07710c36b1d5,Mollitia libero arx thymbra.,Debitis iste vox caritas tantum verbera tergo sed cubo bis. Quis arcus perferendis vindico capto ad usus. Tardus provident ventito venia adsuesco hic abstergo iusto.,6706701a98ac07710c36afe8,219
6706701a98ac07710c36b1d6,Dolorem sonitus ex vulgus amplexus reiciendis.,Abundans virga deorsum cras corrumpo. Amplexus cavus nostrum. Asper deprimo commodi coadunatio tabesco aggero tener ipsam spiritus cervus.,6706701a98ac07710c36b015,220
6706701a98ac07710c36b1d7,Aeger thesis denique.,Defaeco adeptio versus cultura sit vinum caste. Tenus decimus varietas officiis deserunt acceptus acidus assumenda. Audeo valeo eos deorsum crur utilis.,6706701a98ac07710c36b063,221
6706701a98ac07710c36b1d8,Coerceo quas tracto damnatio.,Avarus usitas clamo textus tutamen antea vaco caput centum congregatio. Sed comminor corroboro viriliter tres ascisco. Termes vetus illum deduco arceo ambulo iure uter abundans tenuis.,6706701a98ac07710c36b0e6,222
6706701a98ac07710c36b1d9,Dolores comitatus impedit vilis varietas.,Ullam defaeco adipiscor ad annus comis summopere cubicularis amet cultellus. Solum altus vilicus succedo vicinus sursum usitas trado. Aegrus trepide depulso arcus cultura cetera saepe.,6706701a98ac07710c36afdb,223
6706701a98ac07710c36b1da,Stella deorsum sublime videlicet fuga caute triduana deinde.,Audax desparatus vespillo. Vitae absens subvenio. Stultus ancilla magni depraedor cognomen velit conicio sub conscendo.,6706701a98ac07710c36b010,224
6706701a98ac07710c36b1db,Optio thorax vigor demo tego talis.,Pauper civis admoveo terreo apostolus amplus spargo aeger aedificium. Animus coaegresco conduco curso dolorum provident versus ulterius. Addo cibo coerceo.,6706701a98ac07710c36b04b,225
6706701a98ac07710c36b1dc,Audeo deleo aequus dolore adulatio aequitas eum aedificium curriculum caecus.,Certus coruscus crapula nesciunt. Desipio depopulo dolorem. Adsidue aegrus demo tremo.,6706701a98ac07710c36b082,226
6706701a98ac07710c36b1dd,Somnus porro arma aeger non.,Truculenter patrocinor terreo. Defleo volup allatus adhuc tamdiu adulatio deficio vita cogo verbera. Abscido tantillus xiphias vae vae curatio caput vigor appositus adaugeo.,6706701a98ac07710c36b044,227
6706701a98ac07710c36b1de,Ultra adaugeo aggero tabgo.,Cumque una tam nulla sortitus cultura tergum. Consequuntur urbanus tonsor certus patior candidus ascit. Conor cum aro laudantium volup.,6706701a98ac07710c36b081,228
6706701a98ac07710c36b1df,Auditor undique ars subito.,Tam canis celer doloremque via ipsam tertius adflicto. Crinis victus bardus usus atque victus. Comis in tempore astrum ipsa.,6706701a98ac07710c36b0a0,229
6706701a98ac07710c36b1e0,Peior vesper venustas.,Velut vicissitudo terreo. Conspergo ara demulceo ex congregatio colligo thalassinus apto agnitio. Charisma vero ventosus soluta facere delectus.,6706701a98ac07710c36b00d,230
6706701a98ac07710c36b1e1,Vinco dedecor libero astrum tribuo defendo.,Suppono tot umerus copia theologus aro thesaurus vobis cupressus. Delicate adulescens antiquus timor tripudio sunt repellat tener. Admoveo tenax iste cervus atqui sperno armarium quam.,6706701a98ac07710c36b00f,231
6706701a98ac07710c36b1e2,Caelum delinquo admitto adulatio aetas.,Coerceo acer commodi. Aiunt cur delibero adeptio defendo cetera artificiose sollers. Vix votum ullus.,6706701a98ac07710c36b0ad,232
6706701a98ac07710c36b1e3,Consequuntur adduco trucido acceptus ipsa curso adficio.,Laudantium viridis versus tendo repudiandae uterque supra tersus. Angustus apparatus adfero cupiditas. Degenero placeat spoliatio cerno adficio.,6706701a98ac07710c36b0cd,233
6706701a98ac07710c36b1e4,Tonsor taedium abduco umquam arbustum vere claustrum titulus quos.,Fugit adiuvo auctus capitulus claudeo tergum audentia basium cursim. Tam stella cruentus. Nihil verto comptus tardus cado amicitia absens calamitas nesciunt.,6706701a98ac07710c36b07a,234
6706701a98ac07710c36b1e5,Porro coniuratio delibero.,Tendo aestus canis. Architecto modi cupressus aufero super. Possimus corporis comitatus absens denuo urbs crux.,6706701a98ac07710c36b0ec,235
6706701a98ac07710c36b1e6,Deorsum arguo allatus totus vestigium.,Vero vomer beatae campana ullam amitto thymum vox aestus. Absconditus adopto pecus natus caries amicitia conatus. Molestiae adficio maiores villa talio.,6706701a98ac07710c36b0b2,236
6706701a98ac07710c36b1e7,Alii viriliter suspendo condico quisquam curto tego contra.,Aranea sordeo esse. Tandem terror cetera ventito sono aestas tandem contego. Super tactus acidus amita vulgivagus sortitus assentator degero ex supplanto.,6706701a98ac07710c36b0f2,237
6706701a98ac07710c36b1e8,Incidunt varietas desipio acervus delego tantillus.,Contigo bardus verto. Alienus coadunatio est tenuis aequus. Bellum armarium cuius ad demulceo correptius ver decimus sint.,6706701a98ac07710c36b02d,238
6706701a98ac07710c36b1e9,Aduro cumque delectatio umbra.,Umquam defaeco debilito dapifer. Tui caritas vester dolore combibo usitas alo tutis cursus compono. Capio sollicito considero dolore amet.,6706701a98ac07710c36b024,239
6706701a98ac07710c36b1ea,Thema defessus defungo appello undique atrocitas copia.,Turpis calco subiungo sustineo acsi vero demo. Talis vitiosus copia carus communis aqua at terebro. Venia cultura impedit abundans succurro cariosus.,6706701a98ac07710c36b0c1,240
6706701a98ac07710c36b1eb,Patior admoneo alienus vorago cornu ascit pectus torqueo sopor.,Pauper amiculum ultra. Cras vulticulus aperio tempore bene audio earum totus acer. Occaecati cometes uberrime atque cariosus sursum victus.,6706701a98ac07710c36b01b,241
6706701a98ac07710c36b1ec,Universe carbo dolor concedo adiuvo nam uxor totidem.,Despecto certus carmen. Veritatis cohors taceo coaegresco alioqui video desparatus vitiosus ea pecto. Voluptate celebrer adstringo venia cribro vicissitudo ex.,6706701a98ac07710c36b087,242
6706701a98ac07710c36b1ed,Nesciunt trans porro viduo quisquam amor.,Vinculum toties vomica validus trepide. Trado earum bardus. Tres verumtamen debilito.,6706701a98ac07710c36afdc,243
6706701a98ac07710c36b1ee,Adimpleo comedo suppellex pauper eaque et contego curvo.,Tabula arcus vociferor delicate constans aegrus enim. Trans arca campana comes expedita. Vetus assumenda desidero.,6706701a98ac07710c36b077,244
6706701a98ac07710c36b1ef,Dolorem aperte cresco thesaurus aliquam adicio demens tamisium viduo.,Cum cohaero doloribus ullus apto vallum teneo virgo. Caecus ullus appositus dapifer. Molestiae curvo suppellex absque vestrum denique administratio adimpleo delego.,6706701a98ac07710c36b0d2,245
6706701a98ac07710c36b1f0,Tenax cetera tantillus clibanus cursim.,Unus crudelis quidem succedo cubicularis eligendi cursus. Atrox tyrannus tamen tabernus bibo vulgaris cruentus. Tempore altus demulceo vita varius quam cursim.,6706701a98ac07710c36b049,246
6706701a98ac07710c36b1f1,Calamitas sint accendo vinitor benigne.,Molestiae creta cohors. Cetera vae caecus. Stips crapula bibo vociferor.,6706701a98ac07710c36b03e,247
6706701a98ac07710c36b1f2,Bellum arx cometes peior.,Vinitor adopto damnatio apparatus. In caecus demonstro vulariter maiores angulus autem. Strues qui collum valens capto cotidie adsuesco.,6706701a98ac07710c36b061,248
6706701a98ac07710c36b1f3,Deserunt utrum ceno denique ventito.,Copiose calculus tamen accommodo ex benigne conscendo vilitas. Ars credo crustulum beatus adnuo adinventitias. Commodi comptus comedo stultus audacia certus creo quaerat.,6706701a98ac07710c36b0db,249
6706701a98ac07710c36b1f4,Canis ubi animadverto cura terebro utrimque subseco consequatur iste acceptus.,Tantum viriliter apparatus creber concedo consequuntur accusator tutamen cupressus. Admoveo depromo defluo ciminatio nesciunt. Stultus baiulus vomito supra.,6706701a98ac07710c36b006,250
6706701a98ac07710c36b1f5,Sit titulus amita certus vinco ocer nam sponte.,Tero omnis thema ipsa vaco minus. Caveo tabgo spectaculum coniuratio tactus solitudo volaticus tametsi via. Accommodo cribro acies temeritas defungo vehemens.,6706701a98ac07710c36b07e,251
6706701a98ac07710c36b1f6,Tabula esse paulatim aegrotatio.,Subito via appositus decerno acsi coniuratio contego clarus. Voveo neque tantum capillus aiunt titulus adopto. Ciminatio conscendo basium cresco coepi supplanto thermae acsi tibi desparatus.,6706701a98ac07710c36b07e,252
6706701a98ac07710c36b1f7,Alter patria abbas adinventitias doloribus.,Quae arx utrimque vomica vitae conor stabilis cunctatio. Argumentum ulterius carmen civitas debeo quam stabilis. Adficio vinculum vere vito suppono sono possimus bellicus.,6706701a98ac07710c36b0c3,253
6706701a98ac07710c36b1f8,Celo amet unus cotidie deficio brevis nostrum.,Sit vindico eligendi acquiro veritatis velociter aveho dedecor mollitia argumentum. Deripio una substantia substantia combibo amaritudo comitatus defetiscor. Vir timidus adfero veritas antea.,6706701a98ac07710c36b0c2,254
6706701a98ac07710c36b1f9,Antea velum universe.,Tero calamitas depereo culpa canis. Minima coma quas sit culpa pauci. Suus versus virtus aeneus.,6706701a98ac07710c36b029,255
6706701a98ac07710c36b1fa,Impedit aranea cubo.,Desparatus somniculosus bene. Vicissitudo tollo uberrime. Abstergo ancilla sponte.,6706701a98ac07710c36b015,256
6706701a98ac07710c36b1fb,Totidem beneficium aegrus arto circumvenio vox cetera.,Conor urbanus carus nulla claustrum coniecto accusantium censura conitor. Supplanto curtus theatrum. Voluptatum centum stabilis subvenio vicissitudo qui dedico.,6706701a98ac07710c36b0f4,257
6706701a98ac07710c36b1fc,Deludo adulatio vicissitudo animus hic deorsum ago creo teres.,Sustineo caries terga aedificium administratio tardus. Trucido succedo claustrum absens taceo undique. Vesper amor stella ab vado territo nihil cogo subito.,6706701a98ac07710c36afe4,258
6706701a98ac07710c36b1fd,Varietas condico decumbo corona cursus aliqua adhuc vinum cimentarius.,Attollo termes carcer. Speculum cibo annus quo cunctatio. Tremo tondeo deludo catena.,6706701a98ac07710c36b0ec,259
6706701a98ac07710c36b1fe,Sperno vindico terebro.,Versus antepono accusantium caries arceo argentum architecto appello. Admiratio tum attonbitus aequitas iusto. Creator accusantium deludo pauper pectus pauper abbas.,6706701a98ac07710c36afcf,260
6706701a98ac07710c36b1ff,Excepturi varietas labore bestia adfero.,Patruus thymbra aestus accendo compono doloremque ara arx. Ullam vestrum suppono. Super vis sunt universe omnis mollitia considero pax.,6706701a98ac07710c36b001,261
6706701a98ac07710c36b200,Recusandae uterque auctor ad sum coepi tabella.,Adeo tepesco coadunatio advenio aestus tabella adulatio sollers atque. Traho ago alveus crapula spargo curis thymum. Aufero tui aureus adsuesco vel subnecto iste vitium cicuta coma.,6706701a98ac07710c36b029,262
6706701a98ac07710c36b201,Cito crebro sto.,Cunae audio creo absens vomica auxilium altus cras confugo ascit. Angulus comedo distinctio sulum. Compello utroque ager delego tempora conicio cum conculco vorago.,6706701a98ac07710c36b061,263
6706701a98ac07710c36b202,Aetas cornu deserunt.,Amicitia cauda comptus alii temeritas comparo comparo adduco. Cognatus custodia infit cauda vilis modi decimus deporto denego deinde. Carpo triumphus sono carmen spoliatio venustas enim viscus.,6706701a98ac07710c36afd0,264
6706701a98ac07710c36b203,Anser nostrum verbum terga statua vulnus crebro neque tam tumultus.,Cilicium quo suadeo degero unus trans aiunt vesica cohors tres. Vox tenetur conscendo adnuo varietas arca cuius vulgivagus complectus. Quaerat cui vespillo combibo in odio.,6706701a98ac07710c36b00a,265
6706701a98ac07710c36b204,Distinctio amplexus victoria confugo cariosus officia.,Abscido utique tempore curso tamisium sum conicio unde adhuc demonstro. Socius beatus auditor colligo sursum tremo credo. Beneficium cervus similique culpo combibo atqui blanditiis.,6706701a98ac07710c36b093,266
6706701a98ac07710c36b205,Stultus accendo vorax audacia vespillo.,Cognatus eaque volubilis sequi commemoro urbs congregatio. Amplus depraedor substantia summa voluptates ater. Vero timidus coma demergo tego somniculosus socius verumtamen nulla.,6706701a98ac07710c36b086,267
6706701a98ac07710c36b206,Impedit tempus voluptatum verto solum contra defleo consectetur.,Fuga auditor bardus. Tergo valens ad considero ullam. Amita cunae crinis adeptio nisi.,6706701a98ac07710c36afd9,268
6706701a98ac07710c36b207,Adaugeo patruus defessus.,Laudantium quod clarus. Absens consequuntur attonbitus depromo. Attollo quod bibo cunae.,6706701a98ac07710c36b02f,269
6706701a98ac07710c36b208,Conicio ocer aufero tot suffragium admiratio caries comprehendo vesica considero.,Appono optio quidem triumphus via desolo alienus. Thymbra solitudo ab attollo admiratio cubo vox usque tantum. Cupio tutamen quam asperiores.,6706701a98ac07710c36b0e0,270
6706701a98ac07710c36b209,Dolorum aut expedita utpote tepesco ullam ab decipio laudantium.,Administratio caste praesentium cattus aequitas provident. Debilito cotidie copiose. Sonitus credo debilito vivo curtus recusandae coruscus.,6706701a98ac07710c36aff0,271
6706701a98ac07710c36b20a,Tantillus combibo virgo video vir blanditiis molestias vesper.,Dens civitas unus comes atavus carpo. Varietas apparatus terror concido. Sponte civis crur.,6706701a98ac07710c36b089,272
6706701a98ac07710c36b20b,Sto clibanus condico verumtamen via thermae depereo.,Confido alveus cultura. Doloribus demum supellex vergo cariosus averto ambitus sperno torqueo. Adipisci curia uxor claro officiis amoveo.,6706701a98ac07710c36b08b,273
6706701a98ac07710c36b20c,Charisma caveo ullus maiores celebrer ago thymbra conqueror architecto aggero.,Tego eum curvo confugo surculus terebro deserunt. Auctor certus ager. Quo socius quas speciosus vestrum cohaero harum adeo molestiae.,6706701a98ac07710c36b092,274
6706701a98ac07710c36b20d,Venia talio solutio atrocitas tantillus.,Tricesimus vapulus bellum. Villa complectus ventus abundans ex cetera deporto ab calco. Alienus vespillo amplitudo subseco confero vesco admitto.,6706701a98ac07710c36b059,275
6706701a98ac07710c36b20e,Numquam spero adipisci cito quod.,Adduco decumbo autem earum. Occaecati eius vix adfero animi tunc dedico vulnus officia. Terreo conspergo vox pax correptius thorax.,6706701a98ac07710c36b03a,276
6706701a98ac07710c36b20f,Creo dolorem magnam crux nulla speciosus magni eveniet.,Spiculum depopulo explicabo deleniti. Bellicus tamquam bardus. Odit pecto usitas cometes cito consectetur pax aveho conturbo quo.,6706701a98ac07710c36b034,277
6706701a98ac07710c36b210,Vox vobis cibus vulticulus ceno.,Apparatus uxor nostrum curiositas sursum. Teres apostolus crudelis tot thalassinus. Subito cribro collum recusandae strenuus carbo.,6706701a98ac07710c36b053,278
6706701a98ac07710c36b211,Aperte vetus spoliatio minima aut excepturi demulceo.,Barba taedium benevolentia acsi coepi delectatio. Copia tamisium tot acsi conatus conculco denuo. Teneo canis speciosus vociferor adipiscor alter cometes depraedor.,6706701a98ac07710c36b05a,279
6706701a98ac07710c36b212,Somniculosus absconditus bellum damnatio contego dolore.,Timor vito triduana attonbitus allatus caste nostrum appono arbor. Delinquo consectetur cultura certus soluta cresco abbas carcer callide depromo. Denego autem armarium cuppedia.,6706701a98ac07710c36b055,280
6706701a98ac07710c36b213,Adeo aegre combibo aperte ratione aggredior vesper alo thesis quaerat.,Curvo ocer sui texo coadunatio aequitas calculus vesco. Amissio adeo delicate conitor vacuus blanditiis comes argumentum. Denego appono decimus.,6706701a98ac07710c36b02b,281
6706701a98ac07710c36b214,Vorax umerus sufficio.,Ulterius comminor cetera trans defero civis sonitus. Certus dolor debilito ultio arbitro abbas. Usque voluptate coma ascisco quod ventosus absens condico delectus cicuta.,6706701a98ac07710c36b0a2,282
6706701a98ac07710c36b215,Dapifer uredo credo sustineo.,Valens defendo virtus acervus eius sustineo aureus. Consuasor tutamen rerum video dolor ut suasoria. Neque thema thymbra coniecto atqui thalassinus timor spargo.,6706701a98ac07710c36b041,283
6706701a98ac07710c36b216,Vito agnosco dolore ver abutor.,Tot vergo chirographum amitto vere. Doloribus adsidue adeptio. Tristis volubilis adiuvo totidem territo vesco audacia clibanus curso.,6706701a98ac07710c36b0f1,284
6706701a98ac07710c36b217,Inflammatio thymbra admoveo speculum amplitudo ultra arma.,Dedecor cohibeo complectus spero alveus. Deleniti conturbo derelinquo aegrus soleo consectetur timor conturbo. Cariosus crepusculum barba magnam abbas abbas suscipit admitto adsum.,6706701a98ac07710c36b0fa,285
6706701a98ac07710c36b218,Accedo verto tenax denuo.,Ulterius aggero avaritia taedium contego excepturi arbitro conculco terga titulus. Careo bardus illo nam cresco advenio venio conventus quam tutis. Causa corrigo cur decipio aequitas votum.,6706701a98ac07710c36b0c5,286
6706701a98ac07710c36b219,Recusandae aegrus voveo creptio vulariter adstringo sollicito.,Ver cornu atrocitas occaecati. Auctus acervus volubilis sui brevis accusantium crux iusto trans. Reprehenderit usus modi veniam appello absum voluptatum.,6706701a98ac07710c36afec,287
6706701a98ac07710c36b21a,Veniam architecto solum agnosco alveus ustulo sodalitas vinculum statua vesica.,Congregatio admiratio aveho asper sumptus beatus pecto adulatio sursum supellex. Adicio tamquam aer confero assentator. Adsidue sol caelum.,6706701a98ac07710c36b0b5,288
6706701a98ac07710c36b21b,Dicta abbas magni.,Vicinus amicitia varietas carbo aliquam ultra. Excepturi soluta quod. Ultra libero umquam recusandae vinco laborum.,6706701a98ac07710c36b031,289
6706701a98ac07710c36b21c,Curtus comprehendo eum.,Spectaculum credo consequatur dolorum alioqui. Attero careo acceptus aeternus curo. Totus victoria cultura venia usus adulescens universe.,6706701a98ac07710c36b03f,290
6706701a98ac07710c36b21d,Assentator dicta adflicto comprehendo cinis temeritas defetiscor.,Testimonium desipio tantum quibusdam tyrannus appello defetiscor calamitas demulceo armarium. Tamisium denego vicissitudo dolores cotidie vehemens sub somnus. Baiulus valens crapula ara benigne arguo vilitas peccatus utrimque.,6706701a98ac07710c36aff7,291
6706701a98ac07710c36b21e,Dolorem creo temptatio vitiosus urbs laboriosam illum acsi congregatio tego.,Creber deleo vacuus deserunt adversus. Patior balbus crinis acies demum. Casso succurro torqueo stips.,6706701a98ac07710c36b078,292
6706701a98ac07710c36b21f,Conforto concido congregatio constans suspendo ciminatio solvo advoco curto acsi.,Arbustum aiunt placeat cum volubilis cursim conservo summisse. Chirographum cultura vacuus arma tempore nulla supellex. Studio caput aperte torrens decerno virtus vulgus approbo vehemens.,6706701a98ac07710c36affe,293
6706701a98ac07710c36b220,Armarium admoneo at.,Caterva reiciendis cattus derelinquo. Qui cras ad illo tenus vulgus vorax vapulus succedo. Decipio magnam amicitia.,6706701a98ac07710c36afd4,294
6706701a98ac07710c36b221,Summa defaeco considero.,Cum territo tabernus cupressus adfectus sollers thorax arbustum. Caritas caries cervus trepide autem tondeo studio absque umbra. Statim titulus copiose occaecati cibo.,6706701a98ac07710c36afd6,295
6706701a98ac07710c36b222,Spero carcer tergum incidunt clam.,Cubitum ea tumultus. Teres vehemens copiose cruciamentum tempus vorago. Voluntarius vestrum tabula.,6706701a98ac07710c36b014,296
6706701a98ac07710c36b223,Auctus avarus basium.,Tego alioqui crepusculum repellat spiritus tamquam angulus. Peior attollo molestiae auxilium vilitas culpo quis cotidie atrocitas deprecator. Et confido accedo verbum inventore statim adaugeo.,6706701a98ac07710c36b0b0,297
6706701a98ac07710c36b224,Aeternus molestiae alius timidus ab sufficio.,Delectatio textus vinculum uxor stillicidium volup vallum occaecati depono theologus. Coadunatio cui aestus carpo consectetur collum dapifer volo. Adimpleo creator quos fuga summisse aranea cultellus acies beatus abundans.,6706701a98ac07710c36b0d6,298
6706701a98ac07710c36b225,Ratione tracto alo.,Consequatur repellendus derelinquo cohaero delicate vespillo. Confugo calco cimentarius sono ambitus aestus. Tonsor recusandae optio terga impedit debeo ventosus cognomen corporis.,6706701a98ac07710c36b0a6,299
6706701a98ac07710c36b226,Nulla dolorum damnatio cilicium traho commodi spargo abscido repudiandae.,Curtus triduana antea. Delectatio sumptus nemo. Ocer hic delectus conitor deputo apud conturbo arbitro crustulum congregatio.,6706701a98ac07710c36afff,300
670670bc2ce0cd253f1fa4ca,uytyui,No Description,670670bc2ce0cd253f1fa4c8,301
