moduleId,title,description,learningMaterialId,moduleKey
6706701a98ac07710c36b0fb,Repudiandae conqueror speciosus ipsa tum audacia absorbeo civis tardus.,Administratio reiciendis blandior. Vicissitudo ipsa commodi cum brevis. Ciminatio vinco decimus bis.,6706701a98ac07710c36b0a8,1
6706701a98ac07710c36b0fc,Caelestis damno concido cervus adficio distinctio cattus charisma.,Viduo callide combibo ver vulgus qui saepe stipes. Stella occaecati umquam acceptus in via. Demitto aduro patria comitatus ceno defessus theatrum.,6706701a98ac07710c36b0a6,2
6706701a98ac07710c36b0fd,Cotidie timidus decet carus.,Bellicus aliqua tendo summa vallum. Delego concido vester aspicio attero cito dedico convoco. Canonicus nulla corona audeo.,6706701a98ac07710c36afd1,3
6706701a98ac07710c36b0fe,Terra molestias damnatio terebro aliquam.,Cognatus officiis iusto titulus atrocitas casso. Succedo tum tremo cuppedia articulus audax. Derelinquo tracto theca uter somniculosus caecus creta admoneo assumenda aestivus.,6706701a98ac07710c36b02e,4
6706701a98ac07710c36b0ff,Adimpleo in appositus video.,Texo curto arguo utor tabella caritas attollo cibus bibo. Ut umquam asperiores attero decerno suscipit. Expedita deficio suasoria decimus.,6706701a98ac07710c36b010,5
6706701a98ac07710c36b100,Degusto consequuntur antea amoveo tardus correptius patruus aestivus congregatio consequuntur.,Amo capio debitis aegre tui tempore culpa autem. Argentum sapiente cicuta ultio ipsa. Curto calamitas temperantia aedificium sodalitas ullus confero capillus demulceo ex.,6706701a98ac07710c36b055,6
6706701a98ac07710c36b101,Provident subiungo aggero cruciamentum usus absens.,Vinitor benigne admoveo. Sumo voluptates thorax acerbitas adnuo eos vitae. Cotidie et toties delectatio veritas facere adipisci deprimo infit laborum.,6706701a98ac07710c36b0c5,7
6706701a98ac07710c36b102,Vicinus vivo spiculum aro cornu arceo vetus audentia.,Accusamus clementia paens crur allatus aestivus cernuus caterva via adamo. Pecus placeat verto doloremque tempore cuius amissio fugiat. Desidero canto cerno officiis sperno ex accusantium cohors.,6706701a98ac07710c36b0f1,8
6706701a98ac07710c36b103,Communis aegrotatio delinquo derideo dens.,Dolor ab apto vulgus bene alius artificiose talis vergo. Demens cruciamentum conscendo minima bonus. Trado admoveo depromo cumque aperio.,6706701a98ac07710c36b081,9
6706701a98ac07710c36b104,Quidem aiunt suppono.,Via attollo libero cribro. Crustulum degenero degero. Pecco absum quam reiciendis agnosco.,6706701a98ac07710c36b06f,10
6706701a98ac07710c36b105,Validus harum claro auctor necessitatibus turbo cupiditate.,Calamitas bellicus ad umquam. Attonbitus pecto voluntarius careo perferendis vindico amissio adeptio. Expedita suspendo adfectus attollo eius avarus ubi nulla.,6706701a98ac07710c36b0c2,11
6706701a98ac07710c36b106,Tamisium non angustus adhuc attonbitus theatrum ventito.,Bis decens somnus denique comis. Coma volubilis architecto decumbo bestia ipsum. Abduco cinis sustineo barba totus defaeco conforto vinum alveus.,6706701a98ac07710c36afe6,12
6706701a98ac07710c36b107,Auctor thermae caveo.,Tabella unde defaeco spes curatio vicissitudo terebro tremo officia. Benigne sodalitas aufero agnosco quas cicuta desipio. Depulso colligo speciosus.,6706701a98ac07710c36b0e5,13
6706701a98ac07710c36b108,Tempore adinventitias paens succedo verbum uxor causa quia.,Terreo charisma communis autus. Ubi celebrer auctor adaugeo surculus cultellus labore molestiae stips. Strues conor cotidie celo quo volup vulnus aequitas tum.,6706701a98ac07710c36b003,14
6706701a98ac07710c36b109,Demoror aptus capio officiis amor at.,Vinculum quos defungo eligendi sperno. Adimpleo autem socius demo. Trepide supellex viriliter sponte verbera cinis quas vergo.,6706701a98ac07710c36b0bd,15
6706701a98ac07710c36b10a,Adinventitias calamitas pecto sum.,Demens denuo vespillo ullam consectetur torrens vix adfero tribuo amet. Denuo terebro vis substantia amplexus vita ut contra carbo. Alius bos ars turpis.,6706701a98ac07710c36b01f,16
6706701a98ac07710c36b10b,Vorago vester dolore unde decumbo aestus attollo acsi.,Tabula tergum avarus tempore fugiat temperantia caecus demens eius tutis. Astrum eos amita thermae. Doloremque accendo quos comparo communis pectus ait voluptatum dens solium.,6706701a98ac07710c36b005,17
6706701a98ac07710c36b10c,Titulus tui quia civis toties consectetur uter rerum vito aqua.,Aeger vulnero coma vereor venio vos summisse. Quibusdam cito infit defessus aequus. Peior usitas quae coniuratio charisma vulticulus dedico.,6706701a98ac07710c36afea,18
6706701a98ac07710c36b10d,Assumenda summisse causa valde titulus deleo caecus defendo vester.,Tertius thesaurus quos sapiente decumbo demo somniculosus exercitationem. Custodia utpote exercitationem terreo tergeo caute infit urbs cito optio. Crudelis tepesco conscendo debitis unus verus canis surgo.,6706701a98ac07710c36b04a,19
6706701a98ac07710c36b10e,Auctus tamisium ulciscor virga vesica ab cunabula pecus tergum.,Verus vulariter desidero absconditus. Canis possimus abstergo necessitatibus. Cariosus terebro id amo calculus tyrannus vere ascit.,6706701a98ac07710c36b0c3,20
6706701a98ac07710c36b10f,Censura vis triumphus cubitum conicio amor theologus temptatio distinctio totam.,Vilitas veniam inventore culpo. Harum vinculum caste rem tergum thermae iste. Aurum arbor ago adsidue.,6706701a98ac07710c36b032,21
6706701a98ac07710c36b110,Illo compello voluptate aut bene accedo decipio dens.,Contigo vulgaris tibi eum angustus totus depulso thymbra tergum volaticus. Debilito aestas taceo agnitio tantillus aliquid cupressus inventore tres. Delego alveus utilis.,6706701a98ac07710c36affb,22
6706701a98ac07710c36b111,Eaque agnitio vir auditor asperiores sequi vestigium suffoco.,Vespillo basium et aegrus toties. Taedium carcer curto ipsum. Civitas adsuesco creber aequitas vinum conforto censura vulnus annus defero.,6706701a98ac07710c36b0f8,23
6706701a98ac07710c36b112,Cauda nostrum cresco maxime veritatis cohaero tabesco consuasor vociferor.,Calculus truculenter aequitas confido aspicio sui desipio. Peccatus atavus tutamen explicabo. Textor officia umbra.,6706701a98ac07710c36b03d,24
6706701a98ac07710c36b113,Comprehendo maiores vomito.,Verus clibanus videlicet doloremque ultra. Cedo adfero umbra coniuratio textor adduco allatus decor cinis arca. Tamen cervus votum umerus calcar summisse circumvenio.,6706701a98ac07710c36b01d,25
6706701a98ac07710c36b114,Teres vis consequatur calamitas thesaurus hic conatus sit aliquam.,Decet vesper vero turpis cras despecto testimonium caterva alias defero. Autus facere pectus verto tres voluptatum depopulo supplanto tui. Demo angulus vitiosus titulus admitto amiculum viduo bene.,6706701a98ac07710c36b086,26
6706701a98ac07710c36b115,Derelinquo tenetur sapiente circumvenio pecus titulus cubitum textor.,Caecus adflicto magni volaticus verus tamquam vae cenaculum dedecor quaerat. Porro tutamen clamo damnatio votum caecus stillicidium adipiscor thesis. Demoror sol virgo laborum avarus cavus degusto.,6706701a98ac07710c36b063,27
6706701a98ac07710c36b116,Suffragium viscus abbas pecus decens attero.,Talio cernuus desipio agnitio ambitus eum valde carcer. Crepusculum currus cupio velut brevis spargo carpo demitto. Nostrum vito adicio conatus theologus tremo addo appono.,6706701a98ac07710c36b0f3,28
6706701a98ac07710c36b117,Desolo conspergo cupressus porro magnam congregatio utilis curto.,Contego thorax antepono color crur eos. Subnecto defleo damnatio laboriosam solutio. Capillus ascisco thesaurus candidus centum maiores victoria occaecati rerum.,6706701a98ac07710c36afef,29
6706701a98ac07710c36b118,Caterva cultura rem tricesimus.,Aegre succedo torrens reprehenderit. Triduana vulnus tenetur conservo unde tamdiu combibo creator. Demoror solum voluptas.,6706701a98ac07710c36b0f5,30
6706701a98ac07710c36b119,Tenus thesaurus aqua bonus labore decens volutabrum vos depono vomito.,Aestas tremo virtus. Creber praesentium arma. Cogo contego at delectatio suffragium sulum convoco.,6706701a98ac07710c36afea,31
6706701a98ac07710c36b11a,Admitto utrimque vulgaris tamquam alter acer tristis suus vado advenio.,Ducimus comis vulgivagus supra vulticulus saepe. Amiculum derideo thymum ad venia cenaculum vilis. Numquam taceo aspicio timor.,6706701a98ac07710c36b01c,32
6706701a98ac07710c36b11b,Damnatio vulticulus combibo fugiat curto antiquus corona.,Cur adhuc fugit strues adhaero calcar statua. Terebro ut soluta varietas conscendo currus. Deludo tubineus temptatio claustrum.,6706701a98ac07710c36b010,33
6706701a98ac07710c36b11c,Cenaculum aggredior admoneo comitatus deserunt cimentarius sub acidus.,Complectus aggredior depraedor cotidie. Commodi itaque surgo tui custodia sto patior est censura sursum. Aspernatur tricesimus ager volup theatrum video aeger crux capillus speciosus.,6706701a98ac07710c36afe3,34
6706701a98ac07710c36b11d,Denique saepe illo et curis similique amitto.,Strues volubilis harum. Valens clementia suffragium adstringo talus caries. Dedico crux torrens tamquam dolores vociferor.,6706701a98ac07710c36b02e,35
6706701a98ac07710c36b11e,Curto inflammatio incidunt cupressus cetera teneo audax architecto.,Peior ciminatio summopere adipisci quia bibo. Apparatus annus antepono venia ratione alius armarium tres. Barba avarus stultus conatus.,6706701a98ac07710c36b0db,36
6706701a98ac07710c36b11f,Audio eveniet ademptio vergo certus.,Suspendo aeneus campana debeo vestrum molestias enim aqua. Utique totam adeptio. Terror id defetiscor suscipio modi hic aro.,6706701a98ac07710c36b07b,37
6706701a98ac07710c36b120,Ulterius adiuvo crepusculum conculco.,Sint suppellex clam cetera. Crustulum bestia aestivus quaerat modi compono sum. Repudiandae comburo velut occaecati facilis deludo conservo dedico.,6706701a98ac07710c36b03b,38
6706701a98ac07710c36b121,Defungo vesper cotidie.,Adnuo demo cena curvo despecto vapulus absconditus ipsum argentum sto. Trans amor aureus desidero. Solum verecundia tres thema voluptatibus.,6706701a98ac07710c36afe1,39
6706701a98ac07710c36b122,Voluptatem solum considero vesper vitiosus confido communis basium crur ubi.,Audentia territo coruscus conculco turba sol careo convoco canis aspernatur. Carbo absens degusto carpo valeo decipio adaugeo contigo cura quia. Eius inflammatio aspicio suus.,6706701a98ac07710c36afd7,40
6706701a98ac07710c36b123,Adeptio at substantia cibo clarus animadverto.,Totidem quae quas deludo. Accusator addo dicta optio minima vigilo coadunatio sopor. Spiritus nesciunt quibusdam.,6706701a98ac07710c36b023,41
6706701a98ac07710c36b124,Abduco amissio testimonium triumphus.,Conicio trepide crebro conor. Voluptas consectetur tergo non denique conspergo recusandae utrum. Alioqui earum tamquam defluo vesica umerus contigo vomer bellicus adhaero.,6706701a98ac07710c36b063,42
6706701a98ac07710c36b125,Utilis tristis condico confugo consequatur.,Vicissitudo tabernus aequus quis ager comptus. Suppellex cruentus nesciunt crebro terror alii corrupti. Commodi capio desolo thalassinus optio doloremque utrimque.,6706701a98ac07710c36b0c0,43
6706701a98ac07710c36b126,Voluntarius catena accommodo maiores cedo patruus avaritia utpote.,Ademptio blanditiis depereo catena. Termes vos demergo delibero quis argentum conicio. Terreo caste ullam celo comparo.,6706701a98ac07710c36b035,44
6706701a98ac07710c36b127,Ascisco demitto truculenter currus.,Adversus solum tracto adinventitias copia aspicio umquam corrigo cibus. Recusandae tricesimus paulatim. Clamo candidus velit quia viduo adaugeo cedo porro.,6706701a98ac07710c36b03f,45
6706701a98ac07710c36b128,Super patria vereor ager reprehenderit concedo conor unde tribuo.,Cunctatio deorsum caveo omnis angelus derelinquo basium sollers quae. Desipio vicissitudo subito crepusculum. Pel uter absconditus aequus solium utilis.,6706701a98ac07710c36b00f,46
6706701a98ac07710c36b129,Versus coruscus civitas sollers.,Denique adiuvo tabula itaque dignissimos depulso modi cuppedia canis. Summisse cognatus thorax harum. Aedificium validus cenaculum benevolentia vicissitudo.,6706701a98ac07710c36b0a3,47
6706701a98ac07710c36b12a,Beatae demens vapulus.,Debitis eos calculus. Tergeo nulla varius. Despecto vigor triumphus.,6706701a98ac07710c36b0ed,48
6706701a98ac07710c36b12b,Comitatus defetiscor ventito clementia tantum tutamen ex molestias expedita.,Vigilo comparo convoco vix ventus deputo iure sit. Caries talio suffragium. Arto antiquus adipiscor consequuntur ascisco unde delego commodo stultus.,6706701a98ac07710c36b0af,49
6706701a98ac07710c36b12c,Cognomen corpus taceo depopulo adiuvo tricesimus aperiam thesaurus.,Auditor absorbeo tui summa bellicus consuasor ocer. Vulpes ventosus tenax qui caput. Armarium textus sperno amita carpo facilis commemoro trado.,6706701a98ac07710c36b026,50
6706701a98ac07710c36b12d,Defendo ustilo crebro tam suggero ullus tyrannus corroboro adfero.,Absum audacia attero concedo testimonium carmen angulus spargo succedo. Carmen undique valeo adimpleo. Utor aiunt synagoga valde bis pax cornu ait xiphias.,6706701a98ac07710c36b0b9,51
6706701a98ac07710c36b12e,Solitudo tredecim ventosus ullam capto decretum tempore defetiscor uberrime caries.,Uberrime cruentus versus textus apostolus adsidue sumptus. Consectetur arceo sint conscendo cauda tutis vero. Concedo provident vobis thymbra caries.,6706701a98ac07710c36b04a,52
6706701a98ac07710c36b12f,Caritas corona torqueo repellendus suasoria canto validus.,Tergo laudantium aurum nisi benevolentia vehemens velut stips vilitas succurro. Strues alienus quas. Tondeo absque tenuis crur certe suggero adversus.,6706701a98ac07710c36b08d,53
6706701a98ac07710c36b130,Custodia aspernatur statim caveo utrimque.,Tandem deporto appono sonitus valeo occaecati solium theologus dedico atavus. Ascit somnus defluo theatrum commodi adulatio. Similique sapiente utique sum celer arguo.,6706701a98ac07710c36b021,54
6706701a98ac07710c36b131,Depereo adopto quas patria sol vespillo.,Valde aestas umquam cupiditas vulariter accedo. Suadeo basium debitis utique reprehenderit conitor exercitationem amiculum succurro. Trepide cuius thalassinus vir cupressus arbor cui crastinus.,6706701a98ac07710c36afd3,55
6706701a98ac07710c36b132,Crebro vinum adeptio tantum casso amplus capillus vulgo umquam tergeo.,Quaerat mollitia vapulus crebro barba velut vitium beatae cultellus. Tumultus caput arguo aedificium nostrum calculus conservo adficio mollitia. Aedificium theatrum barba.,6706701a98ac07710c36b0b7,56
6706701a98ac07710c36b133,Abbas esse cibo angulus brevis spiritus candidus quasi annus.,Conitor terminatio debilito talis. Sint tenuis tracto ducimus amita arbustum umbra. Urbanus tamen voluntarius damnatio avaritia repellendus totidem coaegresco.,6706701a98ac07710c36b03d,57
6706701a98ac07710c36b134,Enim arcus sollers tubineus valetudo antea coma quam voveo.,Iusto ultra villa animadverto. Defetiscor decens arcesso vesco dedecor conservo rem alias. Voco sollicito ullam perferendis.,6706701a98ac07710c36b05e,58
6706701a98ac07710c36b135,Infit tamisium vinitor advoco cogo.,Tamen utique catena copiose vomer alius. Calamitas absque cogito quia. Vestrum canis caelum.,6706701a98ac07710c36b0c6,59
6706701a98ac07710c36b136,Creptio repudiandae concedo denuncio.,Auctus cilicium aegrus auxilium viriliter cursim. Appono vae caste degenero acervus incidunt aro sordeo. Sponte sit cognomen aequitas adficio.,6706701a98ac07710c36aff2,60
6706701a98ac07710c36b137,Pauci abbas apostolus in triduana abstergo dolorum alias cohaero velut.,Bene teneo suppono crux color explicabo adversus dens tamquam. Peior dedecor succedo tersus socius annus coaegresco virtus amissio. Facere suspendo ullam testimonium bestia auctor demulceo compello vesco.,6706701a98ac07710c36afe1,61
6706701a98ac07710c36b138,Tenuis aveho ultio ocer tabgo bardus acquiro.,Solitudo antea suffoco curvo. Vis argentum nemo doloremque. Volubilis suppellex tibi sunt cura suscipit solio adulatio.,6706701a98ac07710c36affa,62
6706701a98ac07710c36b139,Vindico tametsi cunae distinctio.,Desidero aestivus cras libero delectatio. Nihil tempora demulceo adiuvo statim saepe sapiente. Expedita basium cognatus vomito coniuratio assentator vicissitudo avarus ventosus talus.,6706701a98ac07710c36b017,63
6706701a98ac07710c36b13a,Aliqua deputo carus comitatus explicabo.,Doloremque annus abeo totus calculus usitas corona defessus cui. Odio vulgus ultio territo. Caute approbo inventore delinquo pecto avaritia voro depereo balbus.,6706701a98ac07710c36b0c6,64
6706701a98ac07710c36b13b,Antiquus vindico quisquam clibanus libero voluptatibus viridis cenaculum.,Certe acerbitas pel denego amor tantillus vae. Defluo crebro ambulo tendo thalassinus certe censura temptatio fuga. Congregatio comminor capitulus culpo utpote atqui tergum strues adnuo carmen.,6706701a98ac07710c36b0b2,65
6706701a98ac07710c36b13c,Ullus aestivus victus.,Sponte adicio nulla tergo unde aurum crastinus calamitas. Aveho similique celer caveo. Tricesimus tutamen confero.,6706701a98ac07710c36b0e2,66
6706701a98ac07710c36b13d,Aperte tracto tenax summisse.,Tamen circumvenio verus thymbra dolorem reprehenderit sponte. Adversus recusandae necessitatibus thorax natus denuo solvo. Corporis pauci undique demoror dapifer coerceo decipio.,6706701a98ac07710c36b036,67
6706701a98ac07710c36b13e,Dolorum vorago crinis ocer teneo dolore creber uter.,Tardus clamo debeo. Appono vetus corrumpo ventosus valetudo asporto careo. Pel thema ancilla cunae una laborum odit aliqua verumtamen.,6706701a98ac07710c36b051,68
6706701a98ac07710c36b13f,Cibo umbra suspendo thorax aro cribro adamo villa ambitus.,Amor conicio debilito cuius antepono collum soleo. Theologus aggero balbus. Patruus admitto voluptatem velum ab trepide vicinus cuius.,6706701a98ac07710c36b05c,69
6706701a98ac07710c36b140,Complectus provident super curvo truculenter earum crebro incidunt una degero.,Vos patria attero et vociferor cerno. Amoveo vigilo confero tricesimus tibi aeneus aestus advoco. Arcus cohors ullam est textor deprimo toties tunc.,6706701a98ac07710c36b0c5,70
6706701a98ac07710c36b141,Sulum aegrotatio trans texo tonsor.,Comprehendo claro conspergo tenus arx ulciscor triumphus studio vulgaris arx. Deripio canis vulgivagus comptus suffragium. Sed usque canonicus dapifer synagoga delibero cicuta amplitudo circumvenio.,6706701a98ac07710c36b080,71
6706701a98ac07710c36b142,Sponte vinco et velut summa bos aqua arto curriculum.,Ex vulticulus averto bene defetiscor eligendi crastinus sono surculus. Beatus autus color caecus eveniet uterque debilito cilicium thorax cupressus. Quos accommodo caelum suggero attonbitus stipes delinquo collum turbo volaticus.,6706701a98ac07710c36b0b4,72
6706701a98ac07710c36b143,Solitudo vetus pax defaeco rem celer adeptio alius.,Cogo coniuratio aeger. Nostrum verbera accommodo eligendi. Abeo veniam fugiat mollitia excepturi tracto cornu textor.,6706701a98ac07710c36b0f1,73
6706701a98ac07710c36b144,Sustineo auditor taedium compono.,Commodi usitas amor civitas adhuc. Autus laboriosam texo demens autem adulescens vulnero deorsum appositus enim. Ullus apto tabernus succedo solium.,6706701a98ac07710c36aff0,74
6706701a98ac07710c36b145,Tamquam angulus compono viduo terminatio rem velum cui subvenio.,Careo creptio arto copia vae placeat brevis. Vesica sumptus beneficium thema. Commemoro vesco amitto ocer decerno.,6706701a98ac07710c36b008,75
6706701a98ac07710c36b146,Censura atque decens delicate.,Enim repellat porro dignissimos accusantium ciminatio. Decet usque custodia tollo abscido appello desparatus volutabrum. Clamo eveniet thermae attero vigor cruciamentum candidus ea cauda brevis.,6706701a98ac07710c36b0d0,76
6706701a98ac07710c36b147,Cilicium truculenter eaque aequus benevolentia spoliatio.,Truculenter hic constans videlicet tenuis teneo dignissimos. Tyrannus subnecto adipisci ventus. Truculenter tumultus deduco quas absque eligendi.,6706701a98ac07710c36b03c,77
6706701a98ac07710c36b148,Vetus adicio copia optio aliquam.,Animus tolero crastinus tandem arbitro cariosus. Vesper antepono sodalitas. Quaerat aequitas ipsam aequus solutio torrens sophismata viriliter architecto conor.,6706701a98ac07710c36b02c,78
6706701a98ac07710c36b149,Cresco strenuus cena illo volaticus uterque chirographum admiratio ceno.,Annus adimpleo aliqua aperiam sodalitas causa arbor urbanus arma. Admitto testimonium peccatus suscipit. Auxilium venustas depromo speciosus aequitas viscus brevis auctus.,6706701a98ac07710c36b038,79
6706701a98ac07710c36b14a,Occaecati ter accedo nemo tergeo sursum uxor calculus.,Temperantia desparatus vilis spoliatio vigor tamquam copiose commodi arbor. Comburo tonsor carpo solutio capio abstergo sublime. Arguo antiquus vulpes colligo.,6706701a98ac07710c36b0c8,80
6706701a98ac07710c36b14b,Numquam arbustum derideo vita tenus eveniet timidus triumphus campana.,Tempora thesis atqui demonstro defluo turba antepono totidem cena. Valens creber adipisci tandem pecus benigne. Condico subiungo laborum subseco sed.,6706701a98ac07710c36afd9,81
6706701a98ac07710c36b14c,Vigilo solio blandior corrigo tubineus voro crustulum.,Acies vinculum barba urbs video. Distinctio beatus cometes cupiditate calamitas error. Usitas cilicium at acidus desolo accusantium delectus.,6706701a98ac07710c36b091,82
6706701a98ac07710c36b14d,Suadeo volup thesaurus sum.,Cras cura spectaculum tonsor laudantium abundans cetera odit tunc. Laborum accedo damno despecto conqueror sollicito tot stabilis. Clarus animus taceo civitas.,6706701a98ac07710c36b073,83
6706701a98ac07710c36b14e,Abutor quas basium vomer agnosco conduco cultura.,Crastinus suppellex cogo vos tempore cogo coma alveus tumultus. Admitto cura somniculosus. Cicuta comptus auxilium eligendi apostolus.,6706701a98ac07710c36b028,84
6706701a98ac07710c36b14f,Conturbo catena arceo earum libero adipisci exercitationem thermae depopulo ullam.,Civis assumenda acervus ex comes armarium creo alienus coma cado. Absque laborum dolorum via voluptatem. Atrocitas acerbitas vilicus utpote voluptas volubilis.,6706701a98ac07710c36b005,85
6706701a98ac07710c36b150,Degenero pauci basium at perspiciatis derideo necessitatibus ager.,Eveniet spoliatio cubo cuppedia vitae vesper color conatus arx concedo. Exercitationem sol tabernus autus sortitus claustrum ciminatio cariosus repellendus. Addo suasoria solio sursum campana amplitudo corrigo absorbeo tricesimus.,6706701a98ac07710c36b072,86
6706701a98ac07710c36b151,Sumptus cornu adversus accusantium autem deduco peior somnus sollers.,Temporibus perspiciatis acervus avaritia averto curso crebro. Sonitus tollo capitulus virtus adaugeo degero amiculum thesaurus officia. Territo aegre velociter laborum debeo velit cresco.,6706701a98ac07710c36affb,87
6706701a98ac07710c36b152,Ascisco suffragium ulciscor utor totidem campana asper est.,Ulterius sint cognatus sustineo nam suppellex validus. Autus beneficium tertius civitas conitor. Defluo voluptatibus vallum pecus.,6706701a98ac07710c36b0d8,88
6706701a98ac07710c36b153,Vox tolero impedit.,Tricesimus accendo tracto candidus compono. Tunc cunae audio cibus cuppedia tricesimus statua degusto conculco adulatio. Avaritia vigilo cito.,6706701a98ac07710c36aff8,89
6706701a98ac07710c36b154,Abbas crinis armarium ultio verto sumptus appono conspergo.,Sint tamen uredo molestiae arbitro tum curiositas. Certe conservo a absque tendo tenuis ex desparatus. Taedium bellicus vesper cuius nulla ipsam aiunt capio corroboro vitae.,6706701a98ac07710c36afe4,90
6706701a98ac07710c36b155,Eligendi vulgaris adfero utrimque tantillus teneo.,Aveho aegrotatio vorax. Votum credo crux aqua viscus sortitus contabesco demum capitulus ultra. Quidem nam patruus nisi harum acies laboriosam denuo usus.,6706701a98ac07710c36b0b6,91
6706701a98ac07710c36b156,Amoveo animus usitas perspiciatis bos tersus balbus decerno solium.,Aestus vulariter numquam adduco teneo ventito defleo. Spargo vix aestas deleniti capio. Quam cubo auctor sto tactus deripio sint.,6706701a98ac07710c36b05e,92
6706701a98ac07710c36b157,Teneo averto calcar defaeco omnis.,Temeritas defluo abutor cohaero aetas cogito aranea nobis. Eveniet tui carbo. Strues esse spectaculum claustrum.,6706701a98ac07710c36afe2,93
6706701a98ac07710c36b158,Administratio blandior sum coniuratio.,Desolo taedium tollo adfero. Vilitas aegre cohors censura spes ventus truculenter accommodo sodalitas. Cognatus absque aduro adopto tepidus eaque titulus balbus.,6706701a98ac07710c36b0da,94
6706701a98ac07710c36b159,Amiculum cerno arca vos totidem calcar summisse cruentus.,Velut votum aedificium amaritudo tergeo aperio venio. Admiratio carmen supellex caries adnuo solutio accedo adduco bardus. Theca veniam uredo maxime decens.,6706701a98ac07710c36b0d4,95
6706701a98ac07710c36b15a,Corrupti tui possimus suspendo uter voco altus attonbitus aequitas ater.,Dolores amiculum sufficio voco atavus. Triumphus crustulum turba altus auxilium arbustum territo adipiscor nostrum. Maxime coepi coaegresco nihil.,6706701a98ac07710c36b0f3,96
6706701a98ac07710c36b15b,Aeneus amplitudo pel sollers ascit verecundia uter vesper comis.,Ex curriculum desidero concedo absconditus claro stipes in. Vetus complectus circumvenio strues ustulo theologus aro compello subvenio cariosus. Canto denuo timidus tribuo sint defleo caute bibo accedo odio.,6706701a98ac07710c36b007,97
6706701a98ac07710c36b15c,Illum atrox tabula comburo patruus vulticulus.,Tersus tantillus et verbera deleo ter crustulum virtus causa. Vestigium suspendo denego adfectus eius voveo auctus excepturi subiungo. Textor vereor similique arbitro ter taceo ustilo sequi.,6706701a98ac07710c36b016,98
6706701a98ac07710c36b15d,Sto eveniet delicate creator in iure thema tubineus timidus calco.,Deporto aperte alioqui contego vinitor. Terga valetudo titulus cohaero supellex commodo comburo. Sub quod votum strenuus alii claustrum arto contabesco.,6706701a98ac07710c36b046,99
6706701a98ac07710c36b15e,Statua amaritudo conservo tunc considero tepidus utroque.,Deleo cultellus vergo censura decretum. Autus copia virgo victus temptatio arguo bibo colligo. In nihil tener ulciscor commodi clamo cunae deorsum acidus.,6706701a98ac07710c36b077,100
