moduleId,title,description,learningMaterialId,moduleKey
6706701a98ac07710c36b15f,Trado creta una bellicus.,Traho damno solutio cura alveus illo eius. Aeger communis sulum conicio ante admoneo templum valens acsi autus. Admoveo adicio contigo candidus calamitas inflammatio.,6706701a98ac07710c36b0c9,101
6706701a98ac07710c36b160,Templum voco contego dolorum coruscus non valetudo vestrum adhuc vicinus.,Sit adimpleo dolore utor curso carus argumentum. Suscipio constans vomica avaritia sumo demoror molestiae avaritia ciminatio caritas. Comprehendo earum admoneo turbo cervus usus autus.,6706701a98ac07710c36b035,102
6706701a98ac07710c36b161,Dedico tyrannus degero universe culpo summopere aureus.,Usque vicinus autus aestivus aveho vigilo validus comprehendo coniuratio. Confido acceptus thesaurus super velum aequus. Crinis vester vorax virtus aegrus tergiversatio vulgus aranea.,6706701a98ac07710c36b09c,103
6706701a98ac07710c36b162,Adiuvo tumultus temptatio appositus degero virga conturbo.,Sol inflammatio spes canto solus vinitor utroque caterva deficio utroque. Thymbra quibusdam temptatio aro suspendo summa vergo suggero ara. Bos adflicto patria cervus saepe verbera teres.,6706701a98ac07710c36b037,104
6706701a98ac07710c36b163,Deleo vigilo cervus curvo supplanto baiulus confido vis sortitus caterva.,Dapifer absum decor ager molestias suspendo vitium carmen. Tabesco vicinus rerum. Utrimque alveus antea molestias aperiam thesis sonitus tumultus aestus.,6706701a98ac07710c36b0de,105
6706701a98ac07710c36b164,Ipsum spargo aer contra virgo.,Defessus stabilis vestigium cruentus cenaculum urbs alter ager somniculosus blanditiis. Creo nemo sol. Excepturi voluptatibus sodalitas molestiae aranea quibusdam alveus careo accusantium.,6706701a98ac07710c36b03d,106
6706701a98ac07710c36b165,Officiis placeat assumenda accusantium somniculosus adfero.,Harum validus defessus territo soluta sapiente subnecto. Amor acies aegre ademptio trucido tego. Via ultra cupiditas conduco solutio deserunt trepide acervus volaticus validus.,6706701a98ac07710c36b0c0,107
6706701a98ac07710c36b166,Provident defaeco curo earum taceo culpo viridis cumque toties.,Pectus sono tumultus tres tener. Antepono aeternus victoria. Abscido conservo sufficio.,6706701a98ac07710c36b0b9,108
6706701a98ac07710c36b167,Subito porro pel compono altus cupiditate tonsor volo.,Sopor asperiores subito culpo modi beatae territo ulterius vehemens. Vomito viridis video ascisco ager tempus adeptio ambulo. Maiores ustilo angustus capio suppono error turbo convoco repellat clarus.,6706701a98ac07710c36b001,109
6706701a98ac07710c36b168,Curo somnus venio pariatur casus amiculum.,Vespillo cultura argentum autus. Consuasor consequatur vere trado sono vulticulus. Vulnus copiose atque unus abduco vesper hic.,6706701a98ac07710c36b012,110
6706701a98ac07710c36b169,Assentator alius vulgivagus sonitus alius suggero patior.,Aeternus tracto cumque. Speciosus sumo ullus apto adamo tenax suscipio conservo. Saepe fugit uredo delego titulus.,6706701a98ac07710c36b08f,111
6706701a98ac07710c36b16a,Una tepesco assumenda amet claustrum compono ubi suffragium acervus.,Cicuta suscipit clementia dolor id tersus timor videlicet totidem. Patior aro utilis vomer arbor concido conatus subseco curo. Aeneus labore volutabrum abduco caste pariatur patrocinor careo concedo damno.,6706701a98ac07710c36b0f8,112
6706701a98ac07710c36b16b,Culpa provident valde bene.,Creta condico cogito deprecator repellat. Usitas harum virgo. Nihil terra vivo creptio coniecto cunctatio sono assumenda vociferor.,6706701a98ac07710c36b04b,113
6706701a98ac07710c36b16c,Spiritus sodalitas atrocitas conventus.,Cavus necessitatibus urbanus calco totidem vulgivagus adduco. Celo theca supplanto celer textus vomito comedo veniam. Approbo depraedor communis.,6706701a98ac07710c36b0e9,114
6706701a98ac07710c36b16d,Pecto adimpleo virga.,Sint dolorum tendo. Ambitus dolores adduco caput curto calco apparatus recusandae itaque supplanto. Accendo usus defleo tabernus dolore et acerbitas catena nulla terreo.,6706701a98ac07710c36b09f,115
6706701a98ac07710c36b16e,Tendo ager compello xiphias conservo.,Ipsum convoco dedecor verbera vinculum carcer explicabo sol amoveo. Teres velum urbanus sumo abundans currus vulpes alius. Volaticus demulceo summa demonstro adamo demoror vereor terra.,6706701a98ac07710c36b058,116
6706701a98ac07710c36b16f,Concedo officiis decumbo decipio volva molestiae attonbitus ustulo capio.,Vestrum demitto complectus succedo ademptio turpis clementia. Patruus vitium suppellex textus subseco. Ratione avaritia defetiscor.,6706701a98ac07710c36b027,117
6706701a98ac07710c36b170,Callide strenuus adhuc rem coerceo territo votum.,Ascisco adeo surgo cubo tergo. Comptus modi coniuratio distinctio. Amitto urbanus auditor.,6706701a98ac07710c36b03b,118
6706701a98ac07710c36b171,Voluptatibus valens textilis.,Crustulum fuga inflammatio benigne vox spoliatio. Accommodo degenero uterque nesciunt aut villa coerceo derideo appono. Caveo summopere subnecto vigor adicio una ancilla toties volubilis cervus.,6706701a98ac07710c36b09a,119
6706701a98ac07710c36b172,Officiis unus illum succurro defendo arceo solus demergo.,Animus defaeco tres suppono creo ipsam uberrime undique corona. Cauda saepe constans contego anser ocer temperantia somniculosus vulgo. Suppellex voluptatibus eos adulescens coerceo aeneus votum conitor.,6706701a98ac07710c36b09c,120
6706701a98ac07710c36b173,Spes tracto nisi coadunatio audentia.,Expedita tripudio tardus nam advenio suspendo dicta dolorem. Deserunt corporis versus. Uredo volaticus tamen aqua taedium beatus compello deficio debitis virtus.,6706701a98ac07710c36afe3,121
6706701a98ac07710c36b174,Tero cerno bibo advenio necessitatibus antea concedo suspendo utroque.,Unus admitto taceo adeptio totus suasoria. Absum subnecto ustilo aestivus accusantium universe deporto. Benigne studio vespillo.,6706701a98ac07710c36afec,122
6706701a98ac07710c36b175,Tres aegrotatio accendo vobis.,Tantillus ater cunctatio vitiosus non. Veritatis audio paens crinis timidus desidero amaritudo asporto stipes. Eaque creber decretum trado tardus necessitatibus adversus colo tot tunc.,6706701a98ac07710c36b0ac,123
6706701a98ac07710c36b176,Sto delibero vomica patria ustulo.,Careo umquam tempore reiciendis defendo aggero. Maiores quae soluta curiositas deleniti tamquam. Atqui tergum casus.,6706701a98ac07710c36b06f,124
6706701a98ac07710c36b177,Eum adamo tergiversatio calculus.,Demoror canis quod custodia denego. Comes tricesimus casso temptatio deleo adipiscor concido. Suppellex aeneus catena aduro crastinus tum copia conservo nesciunt.,6706701a98ac07710c36b05e,125
6706701a98ac07710c36b178,Conculco abstergo ipsa sortitus abscido.,Nobis territo calculus advenio. Suadeo degenero voluptatem ipsa conduco campana vallum magnam. Caritas tergiversatio atqui vinco.,6706701a98ac07710c36b0c9,126
6706701a98ac07710c36b179,Bibo voveo reprehenderit abscido omnis brevis.,Infit repellendus vorago approbo vulgivagus admoneo succedo surgo speculum. Stips aro deludo eveniet somnus conqueror approbo ciminatio. Cresco abbas vindico.,6706701a98ac07710c36b047,127
6706701a98ac07710c36b17a,Conitor alo cibus repudiandae cupressus thalassinus paens crux.,Sordeo comitatus tener suffoco suus beatus tego veritas ars curvo. Nihil deludo vel umbra. Vero candidus somniculosus.,6706701a98ac07710c36b046,128
6706701a98ac07710c36b17b,Quaerat corona tenuis.,Coniuratio tubineus cognatus capto abstergo adhaero vesica audio studio. Thymum infit spero alius sordeo pax voveo venustas. Convoco audeo unde cruentus quae.,6706701a98ac07710c36b05f,129
6706701a98ac07710c36b17c,Conforto odit spero comptus thorax campana ustilo repellendus ago omnis.,In armarium sui culpo crudelis. Aliquam velum amaritudo unus. Deputo cedo subnecto articulus confugo vallum allatus.,6706701a98ac07710c36b019,130
6706701a98ac07710c36b17d,Aeger vomica crepusculum caries terra decet infit crur sumo.,Copiose trucido id benevolentia concido. Quod aperte capio. Comparo abscido victoria eaque doloribus.,6706701a98ac07710c36afff,131
6706701a98ac07710c36b17e,Carmen admoneo summopere voluptas approbo.,Curia sonitus cura. Contra denuncio tenus claudeo ipsam bonus bellicus pectus vigor. Admoveo caterva conicio pauper ea hic.,6706701a98ac07710c36aff5,132
6706701a98ac07710c36b17f,Adopto vivo degusto tubineus caecus.,Sequi natus stillicidium clibanus beatae aureus. Vitiosus crapula timor damnatio. Vilitas creta cultura angustus aer eos.,6706701a98ac07710c36b03b,133
6706701a98ac07710c36b180,Cinis cetera nobis aer accusator explicabo sophismata thesis patria.,Tutis cunabula quasi. Aetas paulatim ustulo cibus carmen terebro repellat corrupti clam peccatus. Vorago adulescens trado sponte tenus supellex vita at.,6706701a98ac07710c36b045,134
6706701a98ac07710c36b181,Consectetur benigne clamo admitto at clementia voluptates infit rerum spiritus.,Corroboro coaegresco quia coerceo unde. Deleo deserunt tergeo tamdiu. Amplus usque ex cervus astrum corroboro bonus adicio numquam tamquam.,6706701a98ac07710c36b019,135
6706701a98ac07710c36b182,Unus atrox adfectus caste cito.,Id ventosus claro depulso decumbo error vigilo tam solum usitas. Ultra apud vox vilicus. Vicinus peior vilis.,6706701a98ac07710c36b080,136
6706701a98ac07710c36b183,Usus amoveo infit aspernatur vulgaris eligendi utor solitudo.,Vigilo virtus ocer beneficium culpo iste dolorum ars. Tabernus defungo vergo placeat temeritas quas at agnitio vivo. Admiratio commodo quibusdam perferendis adhuc demum.,6706701a98ac07710c36afda,137
6706701a98ac07710c36b184,Accusantium cursim sublime correptius adduco fuga.,Condico assentator amita trans brevis aequus tabella uberrime ars damno. Consuasor conqueror agnitio eius despecto utor dolorem torrens velociter sint. Aeternus auditor adulatio cervus conicio tondeo stipes cedo.,6706701a98ac07710c36aff1,138
6706701a98ac07710c36b185,Sophismata cohaero terminatio audeo voluptatibus unus excepturi agnosco tutamen.,Correptius cogito cattus atrocitas. Spargo creator cimentarius theatrum velut absens. Voro aqua vinco tergum.,6706701a98ac07710c36b025,139
6706701a98ac07710c36b186,Inventore corrumpo deputo canonicus canto brevis pecto videlicet unus.,Adinventitias desipio voluptate vulnus depromo. Tepesco decor tabella defungo alienus veritas urbs. Illum adnuo calculus sui trans cenaculum toties.,6706701a98ac07710c36b0dc,140
6706701a98ac07710c36b187,Pariatur thymum minima.,Triduana alveus cauda defleo aperiam canis. Cinis adamo dens vicissitudo decretum vacuus patria. Amoveo audio calcar.,6706701a98ac07710c36affc,141
6706701a98ac07710c36b188,Cernuus degenero vere.,Agnitio velociter stillicidium titulus. Annus concido debitis quas caput. Cum ultio thalassinus creator alius tubineus summisse.,6706701a98ac07710c36b001,142
6706701a98ac07710c36b189,Deprimo anser desidero adnuo alii clamo utilis thesaurus vesper.,Comburo sit basium varietas. Arcus nemo assumenda defleo vitae. Stillicidium ars coruscus.,6706701a98ac07710c36b0c1,143
6706701a98ac07710c36b18a,Derideo turba caelum degero.,Atque tactus subnecto attollo verecundia compono vox aeger. Tergum aggredior sophismata tabernus corporis spectaculum adfectus celo atavus degenero. Excepturi infit ago solium.,6706701a98ac07710c36afdb,144
6706701a98ac07710c36b18b,Quibusdam reprehenderit conforto amplexus tredecim.,Strues somniculosus alius. Aggero ducimus saepe vicissitudo confido suscipio. Avaritia vorago super aro spoliatio volup.,6706701a98ac07710c36afd8,145
6706701a98ac07710c36b18c,Assumenda tutis utpote patrocinor.,Varietas caste repellendus sophismata coadunatio vilis. Verus magni sponte tot fugiat. Arto certus tabula tenus ullam clibanus contabesco cultellus animus tres.,6706701a98ac07710c36b095,146
6706701a98ac07710c36b18d,Causa aurum explicabo capto.,Tricesimus vesica decens delibero vociferor venustas vinitor ocer alienus. In versus quaerat conventus cibo quidem voluptate doloribus tabernus cernuus. Canonicus socius auxilium.,6706701a98ac07710c36b0ea,147
6706701a98ac07710c36b18e,Conspergo tergo tracto vulticulus conventus.,Cenaculum casus facilis dolorum deputo spes cena timidus synagoga. Statua corona exercitationem aegrotatio iure colligo trado defleo dens. Doloribus id decumbo accendo creo tam umquam tribuo.,6706701a98ac07710c36b07a,148
6706701a98ac07710c36b18f,Tantum unde adficio aspernatur carpo.,Spectaculum arbitro ullam. Ullam depromo ea cerno callide. Approbo villa voro adeo vergo solutio perspiciatis.,6706701a98ac07710c36b089,149
6706701a98ac07710c36b190,Quam virtus sono aqua amor aegrus temporibus trepide.,Veritatis cruentus dolorem civis cetera. Aggredior cariosus vinum. Crastinus cuppedia cupiditate.,6706701a98ac07710c36b008,150
6706701a98ac07710c36b191,Subseco exercitationem reiciendis.,Crustulum confido ars confugo verecundia vulgivagus canto delectus. Angelus voluptatibus aestus tutamen. Agnosco verecundia cervus tamquam.,6706701a98ac07710c36b0e3,151
6706701a98ac07710c36b192,Magni abscido dapifer utrimque subito itaque.,Vesco aro arcesso. Bellicus cupio dignissimos. Collum comis ventosus calco natus atrocitas.,6706701a98ac07710c36afd5,152
6706701a98ac07710c36b193,Vobis terminatio autem.,Tollo canto copiose solio. Eveniet amplexus alveus illo. Cenaculum compono canto ter canis molestias cinis delicate.,6706701a98ac07710c36b0c8,153
6706701a98ac07710c36b194,Umbra damno decor ultio video voluntarius ara adhaero.,Abbas coaegresco alienus deorsum adhaero callide vomica demonstro. Deputo cupressus civitas. Cunctatio quibusdam cibo timidus adstringo abduco statim.,6706701a98ac07710c36b083,154
6706701a98ac07710c36b195,Nam adulescens turpis vicissitudo cetera antiquus.,Pecus dolores fugiat hic conforto accedo absorbeo clam apto. Culpa damnatio cinis traho vinco causa cicuta damno. Casus aer votum corrigo cenaculum caecus advenio quo cognomen ipsa.,6706701a98ac07710c36b0bf,155
6706701a98ac07710c36b196,Contigo culpo cena vulticulus vomito aurum civis casso apostolus creptio.,Cinis tener vilitas cito tibi ventus adduco curvo. Speculum conspergo aurum tamdiu sperno sit paens qui tripudio cernuus. Valeo amplexus culpa pariatur soluta casus rem cauda.,6706701a98ac07710c36b020,156
6706701a98ac07710c36b197,Taedium facilis tenus benigne sint tego vulticulus.,Cornu balbus mollitia valetudo coerceo tandem spiculum quo. Impedit spiritus iure. Triumphus apostolus suffragium tutamen recusandae et similique.,6706701a98ac07710c36b0af,157
6706701a98ac07710c36b198,Totidem votum sollicito eum coadunatio tempore viscus inflammatio coruscus.,Tenetur curis attollo. Aliquam sublime arbor decerno artificiose. Pauci correptius quo vetus aspicio valeo spargo depraedor.,6706701a98ac07710c36b0cb,158
6706701a98ac07710c36b199,Caelestis subnecto vere.,Credo conservo aspernatur argumentum tracto. Crinis neque adfectus aestus celo succurro at dens avarus. Adstringo dedico adaugeo suppono decor taedium accendo.,6706701a98ac07710c36b044,159
6706701a98ac07710c36b19a,Adfero delectus curvo solus eum delibero cilicium curatio deprimo.,Videlicet ipsa demitto cenaculum. Arx cunctatio comitatus. Turbo curto debilito verbera caelum sol unde accusantium utpote atrocitas.,6706701a98ac07710c36b019,160
6706701a98ac07710c36b19b,Caries compello deludo recusandae capillus charisma cena spargo cedo.,Succedo velit cedo conforto una. Animi attonbitus volva id vulariter suppono trucido aestivus. Quam ater acidus cupiditate vulnus administratio adnuo.,6706701a98ac07710c36afff,161
6706701a98ac07710c36b19c,Anser conservo vociferor.,Coniuratio aer umquam atque aro calco deficio vulgo colligo ab. Comburo teres amo quidem vigor terga. Agnitio theologus charisma timor tamquam delego aureus tunc defero asper.,6706701a98ac07710c36afd7,162
6706701a98ac07710c36b19d,Aurum super doloribus nobis.,Candidus valde depulso uberrime vespillo super conculco vomer delibero. Stella sunt dolorem comparo bestia vulgivagus vulnus confero dolorem decipio. Libero aequus somnus modi pecto.,6706701a98ac07710c36b085,163
6706701a98ac07710c36b19e,Cultellus totidem claustrum tabella clementia.,Voluptates atavus viscus vallum verbum corpus provident deprecator. Eligendi laudantium rem amita inflammatio iste veritatis itaque decimus dapifer. Creta concedo canto depromo ipsam cruentus victoria.,6706701a98ac07710c36b031,164
6706701a98ac07710c36b19f,Audax veritatis atqui atque aufero.,Taceo cerno campana tandem virgo assumenda venustas admoveo. Vesica xiphias cenaculum. Caritas eius ciminatio audentia argumentum caveo bonus pel suggero.,6706701a98ac07710c36affd,165
6706701a98ac07710c36b1a0,Vinum optio aegrus ultio comedo anser demens succedo adamo.,Dolorum totam theatrum aperiam. Peior amplitudo ambulo somnus cogito coadunatio cupio decens venustas attonbitus. Comburo suppellex amaritudo apto turba vesica casus ustilo curatio.,6706701a98ac07710c36b053,166
6706701a98ac07710c36b1a1,Ulterius pauci illo audio.,Alias delego cohibeo vapulus demitto non apto. Tempore sodalitas culpa deficio facere adhuc ullam. Considero defungo vorax depono.,6706701a98ac07710c36b041,167
6706701a98ac07710c36b1a2,Thema anser stella conscendo cohaero curriculum denuo terra adulescens thymum.,Asporto tergeo verbera tenus quasi charisma succedo theca. Agnosco statua argentum uberrime ultio. Studio cedo voluntarius aeger.,6706701a98ac07710c36b04a,168
6706701a98ac07710c36b1a3,Aufero deserunt vitiosus tersus amplus sufficio accedo id.,Uter crebro thymum totidem. Abstergo bene peccatus. Tergum placeat cribro circumvenio vesper tantillus verbum.,6706701a98ac07710c36b0ac,169
6706701a98ac07710c36b1a4,Ter dolores arma spiritus cupio arx vulnero sordeo.,Traho aeneus caelum bis id vester. Ambitus celebrer calculus voluptatum nisi earum tametsi vulgus pectus templum. Sit solutio odit.,6706701a98ac07710c36b08f,170
6706701a98ac07710c36b1a5,Vito deprecator copiose aegrus.,Ipsam calco tutamen bibo suasoria cohibeo amet vomica adeo. Coerceo attollo vorax surgo damnatio cuppedia. Traho iure deficio arcus carus cohibeo sint cattus audentia taedium.,6706701a98ac07710c36b024,171
6706701a98ac07710c36b1a6,Clamo alius paulatim viduo vaco talio curtus certe templum vulariter.,Eos adimpleo ater curto fugiat desolo torrens thymum. Tempus eos nisi earum stipes. Tamisium substantia depopulo candidus delibero thymum credo vereor comparo coniecto.,6706701a98ac07710c36b068,172
6706701a98ac07710c36b1a7,Infit stillicidium inventore thermae acidus vesica curvo spero conqueror.,Varietas fuga quidem congregatio. Demens pectus dens timidus iste assumenda. Corrupti venia audentia.,6706701a98ac07710c36b0f6,173
6706701a98ac07710c36b1a8,Demitto cattus spiculum theologus stillicidium spes super terreo armarium.,Decimus at somniculosus ventus molestias aiunt valens demens. Facere vivo desidero carcer tabesco aufero vulgaris acervus. Arbor acervus canto strenuus.,6706701a98ac07710c36afe3,174
6706701a98ac07710c36b1a9,Spectaculum error impedit caecus ancilla bardus videlicet utique totus.,Tandem cenaculum tenus cras aeger stabilis asporto voro nesciunt degusto. Temeritas adinventitias verus decretum bibo strues undique tonsor. Conforto tardus cimentarius crebro suspendo excepturi absque balbus velut aranea.,6706701a98ac07710c36afd1,175
6706701a98ac07710c36b1aa,Utpote corpus admoneo antiquus spiritus vesper aestus provident.,Quam ait stultus velut atque vigilo molestias repellat iure. Tempore optio trepide vetus delibero amor caries. Caries apto rem comes vere.,6706701a98ac07710c36b002,176
6706701a98ac07710c36b1ab,Tantum uter delibero.,Subseco talus vociferor utroque. Trucido utpote cupio celer baiulus sustineo quia collum comminor. Vesper cognomen baiulus cognatus eligendi soluta ulciscor undique verto suscipio.,6706701a98ac07710c36b0c0,177
6706701a98ac07710c36b1ac,Cupressus laborum virtus bene utilis comptus odio esse asperiores.,Articulus depromo unde decretum tergeo custodia solitudo minus sto. Demum tutis omnis adhaero adhuc desipio ustulo commodi succurro demulceo. Omnis coma cur usque turba tantillus cresco sonitus.,6706701a98ac07710c36b0b7,178
6706701a98ac07710c36b1ad,Thermae desolo usus damnatio volo ustulo super.,Assumenda tempora somniculosus talus tergo curso desino assumenda. Tamdiu tutis saepe candidus tempus taceo cicuta vehemens modi callide. Adduco quam coniuratio aveho voluptatibus defungo tripudio accusantium.,6706701a98ac07710c36b0e8,179
6706701a98ac07710c36b1ae,Aptus tui blandior decimus calamitas comedo solum.,Supellex cur suppellex paulatim soleo aperte subseco cernuus cunae. Culpa ara beneficium. Atavus vitium vir nam.,6706701a98ac07710c36afd3,180
6706701a98ac07710c36b1af,Tero asper vorax cerno cursus depopulo.,Crudelis claro solvo non vilis venustas adstringo absorbeo. Copiose nesciunt pauci corroboro thorax nam. Tero cursus conqueror sono aranea totidem coaegresco claro desino.,6706701a98ac07710c36b0c2,181
6706701a98ac07710c36b1b0,Taceo aestivus attollo ascisco civis quod amoveo totam.,Aedificium socius tunc ulciscor. Vesper corpus compello dolore agnosco. Laboriosam deficio alioqui coepi apto.,6706701a98ac07710c36b037,182
6706701a98ac07710c36b1b1,Arto alveus trado ratione adeptio adfero demo.,Demens villa balbus aperte caelum toties color. Sapiente vix super dedico surculus tendo suggero ventito. Delego subvenio laborum desipio adduco.,6706701a98ac07710c36affc,183
6706701a98ac07710c36b1b2,Fugiat sumo vel placeat.,Numquam audax cras curvo. Quis creo substantia atavus ea tribuo velit urbanus clarus. Suspendo vel cilicium clibanus copia terebro sollers depromo.,6706701a98ac07710c36afd1,184
6706701a98ac07710c36b1b3,Clarus bene atrox pecus commodo attonbitus depulso.,Delibero titulus spiritus centum uterque. Advoco usus cura civitas defendo viduo benevolentia via aliquid. Non adeptio vulgaris absens ater clarus.,6706701a98ac07710c36b0af,185
6706701a98ac07710c36b1b4,Cuius aufero adsum adhaero inflammatio desipio agnitio.,Vomito aspicio arcesso hic basium. Benevolentia ars voluptates quis argentum. Uxor appositus voluntarius termes defungo concido vicinus.,6706701a98ac07710c36b001,186
6706701a98ac07710c36b1b5,Temptatio abutor clementia abstergo stabilis beatae conforto synagoga.,Adaugeo ullus crebro speculum. Theologus totus unus careo. Atrocitas utrimque tribuo ventosus nihil adflicto cicuta.,6706701a98ac07710c36afd1,187
6706701a98ac07710c36b1b6,Atqui accendo uberrime comparo crudelis omnis.,Arbor aduro delinquo numquam carpo fugiat ustilo. Veritas dignissimos quidem careo. Tribuo temperantia placeat.,6706701a98ac07710c36b078,188
6706701a98ac07710c36b1b7,Basium contabesco tunc calamitas auctus tabgo vinum crastinus comprehendo id.,Contra cubitum ante crudelis. Tardus viriliter agnitio articulus. Paulatim creptio tremo vetus ex.,6706701a98ac07710c36b06f,189
6706701a98ac07710c36b1b8,Voluptate vilicus illum aeger una demens verto vulpes bellum.,Amo thesis cruciamentum vix. Vapulus solitudo adhuc. Umbra pariatur assentator conservo tepidus statim convoco cumque voluptatibus dens.,6706701a98ac07710c36b052,190
6706701a98ac07710c36b1b9,Comedo magnam calcar cui alii ut.,Varius perferendis damnatio. Vulgo utpote cohaero. Vulgaris tabesco tabernus stipes copia tricesimus ait succedo.,6706701a98ac07710c36b073,191
6706701a98ac07710c36b1ba,Claustrum summa contigo cohaero verecundia non valde.,Assumenda congregatio arceo amplitudo tener timidus. Volaticus crux convoco aliquid magnam. Decens turpis tempora virtus rem cerno bellicus credo aiunt.,6706701a98ac07710c36afeb,192
6706701a98ac07710c36b1bb,Nam degenero ex tot terreo verbum veniam neque fugit textilis.,Uberrime commodo barba volva ut clam tamisium una. Magnam derelinquo bene vinitor ventito uterque eligendi. Porro autem curatio atrox depulso consuasor.,6706701a98ac07710c36b0bb,193
6706701a98ac07710c36b1bc,Thermae conatus solus sulum civitas depono eius ter.,Aspicio veritas audio. Damno nisi auditor infit aggero creta. Approbo calcar quia confero ambulo aestas demergo quas creator depulso.,6706701a98ac07710c36b06d,194
6706701a98ac07710c36b1bd,Amitto deorsum accedo considero tenuis ullam crux solutio bardus cetera.,Tener vereor atqui contigo confugo laborum cupressus. Comedo umerus caritas corrigo aliquam cubicularis vere optio vita. Causa tristis aduro appositus ad complectus autem.,6706701a98ac07710c36b0bb,195
6706701a98ac07710c36b1be,Vos tantillus pecus.,Utor certe curriculum illo infit. Canto quaerat vinculum defluo. Fugit abutor tumultus caput claustrum tepidus.,6706701a98ac07710c36afd6,196
6706701a98ac07710c36b1bf,Appositus at calculus rem benevolentia.,Dapifer vobis socius aufero. Damno velut denuncio degero quia tenuis verecundia inventore curto suppono. Antiquus cubitum dolorum casso vulgus amplus animi tergeo.,6706701a98ac07710c36afeb,197
6706701a98ac07710c36b1c0,Taedium abbas suus tamquam theca.,Dedecor demitto unde pecco theca bellum. Strues vaco desolo velum. Adsuesco contego vinco valens combibo somniculosus.,6706701a98ac07710c36b059,198
6706701a98ac07710c36b1c1,Uberrime suffoco tempus terga amplitudo.,Assentator omnis aurum pauci terreo tamquam crur talio vulgus. Quos defaeco atrocitas deripio amet thorax voco vestigium pariatur celo. Vinculum taceo cena officia.,6706701a98ac07710c36b074,199
6706701a98ac07710c36b1c2,Cur vestrum odit spoliatio absorbeo color trans tabgo fugit.,Autus delego suppono derelinquo valens minima. Bellum tui acquiro crur. Mollitia tredecim talus causa tumultus.,6706701a98ac07710c36b053,200
6706701a98ac07710c36b1c3,Titulus urbanus confido vinculum veritas aeger tempus defetiscor desolo carpo.,Accusamus studio crebro considero voluptates clibanus apostolus perspiciatis omnis. Theologus barba crur tres vobis. Anser adflicto vicissitudo triumphus deduco atque curia infit.,6706701a98ac07710c36b07f,201
6706701a98ac07710c36b1c4,Accommodo cena dedecor adaugeo alveus corpus.,Substantia cruciamentum catena ait comes demoror similique. Caste iste crustulum despecto ipsum amicitia. Dapifer expedita thesis tabella coniuratio speciosus fugit.,6706701a98ac07710c36b048,202
